{
  "schemaVersion": 1,
  "generatedAt": "2026-03-11T07:36:46.184Z",
  "source": "pipeline-cli",
  "lessons": [
    "M01-L003"
  ],
  "cards": [
    {
      "id": "m01-l003-c01",
      "vocabId": "v-0ab46f92e7",
      "thai": "ฉัน",
      "translit": "chǎn",
      "english": "I",
      "lessonId": "M01-L003",
      "tags": [
        "M01-L003",
        "core"
      ]
    },
    {
      "id": "m01-l003-c02",
      "vocabId": "v-acdc9c7f8e",
      "thai": "ผม",
      "translit": "phǒm",
      "english": "I (male speaker)",
      "lessonId": "M01-L003",
      "tags": [
        "M01-L003",
        "core"
      ]
    },
    {
      "id": "m01-l003-c03",
      "vocabId": "v-e3ef8a701b",
      "thai": "เขา",
      "translit": "khǎo",
      "english": "he / she",
      "lessonId": "M01-L003",
      "tags": [
        "M01-L003",
        "core"
      ]
    },
    {
      "id": "m01-l003-c04",
      "vocabId": "v-a79c6af3af",
      "thai": "คุณชื่ออะไร",
      "translit": "khun chûue à-rai",
      "english": "what is your name?",
      "lessonId": "M01-L003",
      "tags": [
        "M01-L003",
        "core"
      ]
    },
    {
      "id": "m01-l003-c05",
      "vocabId": "v-7a0154647c",
      "thai": "นี่คือ...",
      "translit": "nîi kheuu...",
      "english": "this is ...",
      "lessonId": "M01-L003",
      "tags": [
        "M01-L003",
        "core"
      ]
    },
    {
      "id": "m01-l003-c06",
      "vocabId": "v-e288d14433",
      "thai": "เขาคือ...",
      "translit": "khǎo kheuu...",
      "english": "he / she is ...",
      "lessonId": "M01-L003",
      "tags": [
        "M01-L003",
        "core"
      ]
    },
    {
      "id": "m01-l003-c07",
      "vocabId": "v-7597900aeb",
      "thai": "คุณคือ...ใช่ไหม",
      "translit": "khun kheuu... châi mái",
      "english": "you are ... right?",
      "lessonId": "M01-L003",
      "tags": [
        "M01-L003",
        "core"
      ]
    },
    {
      "id": "m01-l003-c08",
      "vocabId": "v-cda55f5b5e",
      "thai": "ไม่ใช่",
      "translit": "mâi châi",
      "english": "no / not right",
      "lessonId": "M01-L003",
      "tags": [
        "M01-L003",
        "core"
      ]
    },
    {
      "id": "m01-l003-c09",
      "vocabId": "v-0a54507804",
      "thai": "เขาคือใคร",
      "translit": "khǎo kheuu khrai",
      "english": "who is he / she?",
      "lessonId": "M01-L003",
      "tags": [
        "M01-L003",
        "core"
      ]
    },
    {
      "id": "m01-l003-c10",
      "vocabId": "v-688905b601",
      "thai": "คนนี้คือใคร",
      "translit": "khon níi kheuu khrai",
      "english": "who is this person?",
      "lessonId": "M01-L003",
      "tags": [
        "M01-L003",
        "core"
      ]
    },
    {
      "id": "m01-l003-c11",
      "vocabId": "v-6acb169e4b",
      "thai": "ชื่อ",
      "translit": "chûue",
      "english": "name",
      "lessonId": "M01-L003",
      "tags": [
        "M01-L003",
        "core"
      ]
    },
    {
      "id": "m01-l003-c12",
      "vocabId": "v-f40371ec59",
      "thai": "ใช่",
      "translit": "châi",
      "english": "yes / that is right",
      "lessonId": "M01-L003",
      "tags": [
        "M01-L003",
        "core"
      ]
    },
    {
      "id": "m01-l003-c13",
      "vocabId": "v-e2c4943d2f",
      "thai": "ขอโทษนะ",
      "translit": "khǎaw-thôot ná",
      "english": "excuse me",
      "lessonId": "M01-L003",
      "tags": [
        "M01-L003",
        "core"
      ]
    },
    {
      "id": "m01-l003-c14",
      "vocabId": "v-d0c316cc2c",
      "thai": "ประเทศ",
      "translit": "bprà-thêet",
      "english": "country",
      "lessonId": "M01-L003",
      "tags": [
        "M01-L003",
        "core"
      ]
    },
    {
      "id": "m01-l003-c15",
      "vocabId": "v-af0f28e039",
      "thai": "เขามาจากไทย",
      "translit": "khǎo maa-jàak thai",
      "english": "he / she is from Thailand",
      "lessonId": "M01-L003",
      "tags": [
        "M01-L003",
        "core"
      ]
    }
  ]
}
