{
  "schemaVersion": 1,
  "generatedAt": "2026-03-21T09:41:58.063Z",
  "source": "pipeline-cli",
  "lessons": [
    "M01-L004"
  ],
  "cards": [
    {
      "id": "m01-l004-c01",
      "vocabId": "v-871c9bd62f",
      "thai": "ศูนย์",
      "translit": "sǔun",
      "english": "zero",
      "lessonId": "M01-L004",
      "tags": [
        "M01-L004",
        "core"
      ]
    },
    {
      "id": "m01-l004-c02",
      "vocabId": "v-6ad6888f1d",
      "thai": "หนึ่ง",
      "translit": "nùeng",
      "english": "one",
      "lessonId": "M01-L004",
      "tags": [
        "M01-L004",
        "core"
      ]
    },
    {
      "id": "m01-l004-c03",
      "vocabId": "v-afdf936166",
      "thai": "สอง",
      "translit": "sǎawng",
      "english": "two",
      "lessonId": "M01-L004",
      "tags": [
        "M01-L004",
        "core"
      ]
    },
    {
      "id": "m01-l004-c04",
      "vocabId": "v-368c7c205d",
      "thai": "สาม",
      "translit": "sǎam",
      "english": "three",
      "lessonId": "M01-L004",
      "tags": [
        "M01-L004",
        "core"
      ]
    },
    {
      "id": "m01-l004-c05",
      "vocabId": "v-cf99ffc78e",
      "thai": "สี่",
      "translit": "sìi",
      "english": "four",
      "lessonId": "M01-L004",
      "tags": [
        "M01-L004",
        "core"
      ]
    },
    {
      "id": "m01-l004-c06",
      "vocabId": "v-f028feb896",
      "thai": "ห้า",
      "translit": "hâa",
      "english": "five",
      "lessonId": "M01-L004",
      "tags": [
        "M01-L004",
        "core"
      ]
    },
    {
      "id": "m01-l004-c07",
      "vocabId": "v-f6b67b4e6f",
      "thai": "หก",
      "translit": "hòk",
      "english": "six",
      "lessonId": "M01-L004",
      "tags": [
        "M01-L004",
        "core"
      ]
    },
    {
      "id": "m01-l004-c08",
      "vocabId": "v-73bffabf48",
      "thai": "เจ็ด",
      "translit": "jèt",
      "english": "seven",
      "lessonId": "M01-L004",
      "tags": [
        "M01-L004",
        "core"
      ]
    },
    {
      "id": "m01-l004-c09",
      "vocabId": "v-18e34df5c5",
      "thai": "แปด",
      "translit": "bpàet",
      "english": "eight",
      "lessonId": "M01-L004",
      "tags": [
        "M01-L004",
        "core"
      ]
    },
    {
      "id": "m01-l004-c10",
      "vocabId": "v-61140bdbc1",
      "thai": "เก้า",
      "translit": "gâo",
      "english": "nine",
      "lessonId": "M01-L004",
      "tags": [
        "M01-L004",
        "core"
      ]
    },
    {
      "id": "m01-l004-c11",
      "vocabId": "v-31da0816ab",
      "thai": "สิบ",
      "translit": "sìp",
      "english": "ten",
      "lessonId": "M01-L004",
      "tags": [
        "M01-L004",
        "core"
      ]
    },
    {
      "id": "m01-l004-c12",
      "vocabId": "v-ba4059e504",
      "thai": "เบอร์อะไร",
      "translit": "ber à-rai",
      "english": "what number?",
      "lessonId": "M01-L004",
      "tags": [
        "M01-L004",
        "core"
      ]
    },
    {
      "id": "m01-l004-c13",
      "vocabId": "v-2d97b680f6",
      "thai": "ฉันอายุ...ปี",
      "translit": "chǎn aa-yú ... bpii",
      "english": "I am ... years old",
      "lessonId": "M01-L004",
      "tags": [
        "M01-L004",
        "core"
      ]
    },
    {
      "id": "m01-l004-c14",
      "vocabId": "v-0ab46f92e7",
      "thai": "ฉัน",
      "translit": "chǎn",
      "english": "I",
      "lessonId": "M01-L004",
      "tags": [
        "M01-L004",
        "core"
      ]
    },
    {
      "id": "m01-l004-c15",
      "vocabId": "v-e3ef8a701b",
      "thai": "เขา",
      "translit": "khǎo",
      "english": "he / she",
      "lessonId": "M01-L004",
      "tags": [
        "M01-L004",
        "core"
      ]
    },
    {
      "id": "m01-l004-c16",
      "vocabId": "v-6fce5e8c2c",
      "thai": "ขอโทษ",
      "translit": "khǎaw-thôot",
      "english": "excuse me / sorry",
      "lessonId": "M01-L004",
      "tags": [
        "M01-L004",
        "core"
      ]
    },
    {
      "id": "m01-l004-c17",
      "vocabId": "v-217b46aa5a",
      "thai": "ขอบคุณ",
      "translit": "khàawp-khun",
      "english": "thank you",
      "lessonId": "M01-L004",
      "tags": [
        "M01-L004",
        "core"
      ]
    },
    {
      "id": "m01-l004-c18",
      "vocabId": "v-a2028c5b78",
      "thai": "สี่",
      "translit": "sìi",
      "english": "four (low tone)",
      "lessonId": "M01-L004",
      "tags": [
        "M01-L004",
        "core"
      ]
    }
  ]
}
