{
  "schemaVersion": 1,
  "generatedAt": "2026-03-21T05:57:59.742Z",
  "source": "pipeline-cli",
  "lessons": [
    "M01-L001"
  ],
  "cards": [
    {
      "id": "m01-l001-c01",
      "vocabId": "v-c9337e2739",
      "thai": "สวัสดี",
      "translit": "sà-wàt-dii",
      "english": "hello",
      "lessonId": "M01-L001",
      "tags": [
        "M01-L001",
        "core"
      ]
    },
    {
      "id": "m01-l001-c02",
      "vocabId": "v-e653eb5319",
      "thai": "สวัสดีครับ",
      "translit": "sà-wàt-dii khráp",
      "english": "hello (male speaker)",
      "lessonId": "M01-L001",
      "tags": [
        "M01-L001",
        "core"
      ]
    },
    {
      "id": "m01-l001-c03",
      "vocabId": "v-bccbe506b3",
      "thai": "สวัสดีค่ะ",
      "translit": "sà-wàt-dii khâ",
      "english": "hello (female speaker)",
      "lessonId": "M01-L001",
      "tags": [
        "M01-L001",
        "core"
      ]
    },
    {
      "id": "m01-l001-c04",
      "vocabId": "v-217b46aa5a",
      "thai": "ขอบคุณ",
      "translit": "khàawp-khun",
      "english": "thank you",
      "lessonId": "M01-L001",
      "tags": [
        "M01-L001",
        "core"
      ]
    },
    {
      "id": "m01-l001-c05",
      "vocabId": "v-6fce5e8c2c",
      "thai": "ขอโทษ",
      "translit": "khǎaw-thôot",
      "english": "excuse me / sorry",
      "lessonId": "M01-L001",
      "tags": [
        "M01-L001",
        "core"
      ]
    },
    {
      "id": "m01-l001-c06",
      "vocabId": "v-03cc3fe123",
      "thai": "ไม่เป็นไร",
      "translit": "mâi bpen rai",
      "english": "it is okay / no problem",
      "lessonId": "M01-L001",
      "tags": [
        "M01-L001",
        "core"
      ]
    },
    {
      "id": "m01-l001-c07",
      "vocabId": "v-a34b9ddfd4",
      "thai": "ครับ",
      "translit": "khráp",
      "english": "male polite ending",
      "lessonId": "M01-L001",
      "tags": [
        "M01-L001",
        "core"
      ]
    },
    {
      "id": "m01-l001-c08",
      "vocabId": "v-e5c357ab24",
      "thai": "ค่ะ",
      "translit": "khâ",
      "english": "female statement ending",
      "lessonId": "M01-L001",
      "tags": [
        "M01-L001",
        "core"
      ]
    },
    {
      "id": "m01-l001-c09",
      "vocabId": "v-8637eb381c",
      "thai": "คะ",
      "translit": "khá",
      "english": "female question ending",
      "lessonId": "M01-L001",
      "tags": [
        "M01-L001",
        "core"
      ]
    },
    {
      "id": "m01-l001-c10",
      "vocabId": "v-f40371ec59",
      "thai": "ใช่",
      "translit": "châi",
      "english": "yes / that is right",
      "lessonId": "M01-L001",
      "tags": [
        "M01-L001",
        "core"
      ]
    },
    {
      "id": "m01-l001-c11",
      "vocabId": "v-cda55f5b5e",
      "thai": "ไม่ใช่",
      "translit": "mâi châi",
      "english": "no / not right",
      "lessonId": "M01-L001",
      "tags": [
        "M01-L001",
        "core"
      ]
    }
  ]
}
